date,title,wikiSlug,content,link
0121,The Elephant Battle,Naresuan,"In 1593, a pivotal moment in Siamese history occurred during the Battle of Nong Sarai. King Naresuan the Great of Ayutthaya engaged in a legendary 'Yuddhahatthi' (elephant duel) against the Burmese Crown Prince Mingyi Swa. Seated atop his war elephant, Chao Phraya Chaiyanuphap, the King managed to defeat the prince in single combat. This historic victory significantly weakened the Burmese forces and secured Ayutthaya's independence for decades, solidifying King Naresuan's legacy as a brilliant warrior and protector of the kingdom.",https://en.wikipedia.org/wiki/Naresuan
0122,Significance of the Wai,Thai_greeting,"The 'Wai' is the graceful traditional Thai greeting consisting of a slight bow with palms pressed together in a prayer-like fashion. Rooted in ancient Hindu-Buddhist traditions, it is far more than a simple hello. The position of the fingertips—ranging from chest level for peers to the bridge of the nose for monks and royalty—reflects a complex social hierarchy of respect. It conveys humility and peace, symbolizing that the person is unarmed and harbors good intentions toward the recipient, making it an essential part of daily social etiquette.",https://en.wikipedia.org/wiki/Thai_greeting
0123,The Legend of Songkran,Songkran_(Thailand),"Songkran, the traditional Thai New Year, originates from the Sanskrit word 'Sankranti,' meaning astrological passage. The festival is tied to a myth involving King Kabila Phrom and his seven daughters. Beyond the famous water fights, the core ritual involves washing away misfortunes of the past year and purifying one's soul. Thais traditionally pour scented water over Buddha statues and the hands of elders to seek blessings. It is a time for family reunions, temple visits, and the deep-rooted cultural practice of showing gratitude to ancestors.",https://en.wikipedia.org/wiki/Songkran_(Thailand)
0124,Sacred White Elephants,White_elephant_(animal),"In Thai culture, the White Elephant (Chang Phueak) is a sacred symbol of royal power, prosperity, and the King's righteousness. Unlike common elephants, these rare animals are not used for labor; they are considered royal treasures. Historically, the number of white elephants in a King's possession was seen as a direct measure of his divine merit and the kingdom's well-being. According to Buddhist legend, a white elephant appeared in a dream to the mother of the Buddha, marking its eternal spiritual significance in the Southeast Asian world.",https://en.wikipedia.org/wiki/White_elephant_(animal)
0125,The Name 'Siam',Thailand,"Until 1939, Thailand was known globally as 'Siam.' The exact origin of the word remains a subject of historical debate. Some scholars suggest it comes from the Sanskrit word 'Syama,' meaning dark or brown, likely referring to the complexion of the local inhabitants. Others believe it may be related to the Chinese word 'Xian' or an old Mon-Khmer term. The name was officially changed to 'Thailand' (Prathet Thai) to emphasize the identity of the 'Free People' and to foster a unified national spirit under the leadership of Plaek Phibunsongkhram.",https://en.wikipedia.org/wiki/Thailand#Etymology
0126,Thai Spirit Houses,Spirit_house,"Virtually every Thai home or business features a 'San Phra Phum' or Spirit House. These ornate miniature shrines, elevated on pillars, are dedicated to the 'Phra Phum Chai Mongkhon' (the guardian spirit of the land). Thais believe that when humans build a structure, they must provide a separate home for the spirits who resided there first. Daily offerings of incense, flowers, and colorful sodas are made to ensure protection and prosperity, illustrating the beautiful blend of animism and Buddhism in modern Thai daily life.",https://en.wikipedia.org/wiki/Spirit_house
0127,The Thai Silk Legend,Jim_Thompson_(designer),"Thai silk is world-renowned for its unique luster and handmade quality, a status largely achieved through the efforts of Jim Thompson. An American businessman and former intelligence officer, Thompson revitalized the dying craft in the 1950s by introducing modern dyes and international marketing. His home in Bangkok, a masterpiece of traditional architecture, remains a major landmark. However, Thompson's legacy is shrouded in mystery after he disappeared without a trace in Malaysia's Cameron Highlands in 1967, a puzzle that remains unsolved today.",https://en.wikipedia.org/wiki/Jim_Thompson_(designer)
0128,The Ayutthaya Kingdom,Ayutthaya_Kingdom,"Founded in 1350, Ayutthaya grew to become one of the world's most prosperous and cosmopolitan cities by the 17th century. It was a strategic trading hub connecting the East and West, hosting diplomats and merchants from as far as France and Japan. At its peak, the city was filled with glittering temples and complex canal systems. Although it was tragically destroyed by Burmese invaders in 1767, its majestic ruins now stand as a UNESCO World Heritage site, offering a hauntingly beautiful glimpse into the grandeur of Thailand's imperial past.",https://en.wikipedia.org/wiki/Ayutthaya_Kingdom
0129,The Lucky Number 9,Thai_numerals,"In Thailand, the number nine is widely regarded as the luckiest of all numbers. This belief stems from a linguistic coincidence: the Thai word for nine is 'Kao,' which is a homophone for the word meaning 'moving forward' or 'progress' (Kao-na). Because of this auspicious connection, Thais often seek out the number nine for license plates, phone numbers, and wedding dates. It was also the regnal number of the beloved King Bhumibol Adulyadej (Rama IX), which further deepened the nation's spiritual and emotional attachment to this digit.",https://en.wikipedia.org/wiki/Thai_numerals
0130,The Secret Golden Buddha,Golden_Buddha_(statue),"Wat Traimit in Bangkok is home to the Phra Phuttha Maha Suwanna Patimakon, the world's largest solid gold Buddha statue. For centuries, its true nature was hidden under a thick layer of plaster and colored glass to protect it from invading armies. The secret was only revealed in 1955 when a crane accidentally dropped the statue during a relocation, causing the plaster to crack and reveal the gleaming gold beneath. This miraculous discovery served as a powerful symbol of hope and hidden spiritual wealth for the Thai people.",https://en.wikipedia.org/wiki/Golden_Buddha_(statue)
0131,Muay Thai: The Art of 8 Limbs,Muay_Thai,"Muay Thai is the national sport of Thailand and a revered cultural treasure known as the 'Art of Eight Limbs.' Unlike western boxing, it utilizes fists, elbows, knees, and shins as natural weapons. Its roots lie in ancient battlefield combat techniques used by warriors when they lost their swords or spears. Beyond the physical brutality, Muay Thai is deeply spiritual, involving ritual dances like the 'Wai Khru' and the wearing of 'Mongkhon' headbands for protection. Today, it is a global phenomenon that represents the strength and resilience of the Thai spirit.",https://en.wikipedia.org/wiki/Muay_Thai
0201,Wat Arun: Temple of Dawn,Wat_Arun,"Rising majestically from the banks of the Chao Phraya River, Wat Arun is one of Bangkok's most iconic landmarks. Named after Aruna, the Hindu god of dawn, its central 'Prang' (spire) stands over 70 meters tall and is intricately decorated with thousands of tiny porcelain shards from Chinese trade ships. These mosaics catch the first light of morning, creating a radiant glow. Architecturally, the temple represents Mount Meru, the center of the universe in Buddhist cosmology, serving as a spiritual beacon for both locals and travelers.",https://en.wikipedia.org/wiki/Wat_Arun
0202,Balance of Thai Flavors,Thai_cuisine,"The global popularity of Thai cuisine lies in its sophisticated pursuit of the 'five tastes': sour, spicy, sweet, salty, and sometimes bitter. This philosophy reflects a cultural value of harmony within diversity. A single bowl of Tom Yum Goong or a plate of Som Tum is a complex chemical dance—lime provides acidity, chili brings heat, palm sugar adds sweetness, and fish sauce delivers the essential saltiness. This balance is not just culinary; it is a way of life, emphasizing that even the most contrasting elements can coexist to create something extraordinary.",https://en.wikipedia.org/wiki/Thai_cuisine
0203,Chiang Mai: Northern Rose,Chiang_Mai,"Known as the 'Rose of the North,' Chiang Mai was the capital of the ancient Lanna Kingdom until the late 18th century. Surrounded by misty mountains and lush jungles, it offers a stark contrast to the bustle of Bangkok. The city is famous for its hundreds of ornate Buddhist temples, its unique Northern Thai (Kham Mueang) dialect, and its traditional crafts like umbrella painting and silverwork. It remains the cultural heart of the north, preserving a slower pace of life and a deep connection to the artistic traditions of the Lanna people.",https://en.wikipedia.org/wiki/Chiang_Mai
0204,Traditional Thai Houses,Traditional_Thai_house,"The architecture of a traditional Thai house is a brilliant response to the country's tropical climate. Built primarily of teak wood and elevated on high stilts, these structures are designed to withstand seasonal floods and allow cooling air to circulate from below. The steep, gabled roofs facilitate rapid rainwater runoff during monsoons. The open-air space beneath the house is a versatile hub for social gatherings, weaving, or escaping the midday sun. This design philosophy emphasizes living in harmony with nature rather than trying to conquer it.",https://en.wikipedia.org/wiki/Traditional_Thai_house
0205,The Chiang Mai Flower Festival,Chiang_Mai_Flower_Festival,"Every February, when the tropical blooms are at their peak, Chiang Mai hosts its spectacular Flower Festival. The city is transformed into a vibrant sea of chrysanthemums, roses, and orchids. The highlight is the floral parade, featuring massive floats intricately decorated entirely with fresh flowers and plant materials. These floats often depict scenes from Buddhist mythology or Lanna history. This festival not only celebrates the region's natural beauty but also showcases the extraordinary patience and artistic skill of Northern Thai floral artisans.",https://en.wikipedia.org/wiki/Chiang_Mai_Flower_Festival
0206,The Chakri Dynasty,Chakri_dynasty,"Established in 1782 by King Rama I, the Chakri Dynasty has guided Thailand through its transition into the modern era. Rama I founded Bangkok as the new capital, building the Grand Palace as the spiritual and political center of the kingdom. Throughout the 19th and 20th centuries, the Chakri monarchs—notably King Mongkut and King Chulalongkorn—implemented vital reforms in education, law, and technology that prevented Thailand from being colonized. Today, the dynasty remains a unifying symbol of national identity and historical continuity for the Thai people.",https://en.wikipedia.org/wiki/Chakri_dynasty
0207,The Ritual of Wai Khru,Wai_khru_ram_muay,"Before every Muay Thai match, fighters perform the 'Wai Khru Ram Muay,' a slow, rhythmic dance accompanied by traditional music. This ritual is a profound display of gratitude toward the fighter's teachers (Khru), parents, and ancestors. The dance serves several purposes: it warms up the muscles, allows the fighter to claim the space of the ring, and clears the mind for combat. By performing these ancient movements, the fighter honors the long lineage of warriors before them, ensuring that the spiritual essence of the sport remains intact even in modern arenas.",https://en.wikipedia.org/wiki/Wai_khru_ram_muay
0208,The Emerald Buddha,Emerald_Buddha,"Housed in the Wat Phra Kaew within the Grand Palace grounds, the Emerald Buddha is the most sacred religious image in Thailand. Carved from a single block of translucent green jade (or jasper), its history is steeped in legend, traveling through various kingdoms before arriving in Bangkok. The Buddha has three sets of golden robes, representing the summer, rainy, and winter seasons. In an ancient royal tradition, the King personally changes these robes three times a year to ensure prosperity and good fortune for the nation and its people.",https://en.wikipedia.org/wiki/Emerald_Buddha
0209,Loy Krathong Tradition,Loi_Krathong,"Loy Krathong is one of Thailand's most beautiful and romantic festivals. Celebrated on the full moon of the 12th lunar month, people gather at rivers and ponds to float 'Krathongs'—lotus-shaped baskets made from banana leaves and decorated with flowers, candles, and incense. This act serves two main purposes: to pay respect to the Water Goddess, Phra Mae Khongkha, for providing life, and to symbolically 'float away' the grudges, anger, and misfortunes of the past year, making room for a fresh and peaceful beginning.",https://en.wikipedia.org/wiki/Loi_Krathong
0210,History of the Tuk-Tuk,Auto_rickshaw,"The colorful, three-wheeled Tuk-Tuk is an unmistakable icon of Thai urban life. These vehicles evolved from motorized rickshaws imported from Japan after World War II. Over the decades, Thai mechanics customized them with vibrant paint, chrome details, and loud engines, giving them their characteristic 'tuk-tuk' sound. While they started as a humble mode of transport for locals, they have become a world-famous symbol of Bangkok's energetic and slightly chaotic charm. Riding a Tuk-Tuk through the city streets remains a 'must-do' experience for anyone visiting Thailand.",https://en.wikipedia.org/wiki/Auto_rickshaw#Thailand
0211,The Erawan Shrine,Erawan_Shrine,"Located at one of Bangkok's busiest intersections, the Erawan Shrine is a spiritual oasis amidst the modern skyscrapers. It was built in 1956 to ward off bad luck during the construction of a nearby hotel. The shrine is dedicated to Phra Phrom, the Thai representation of the Hindu god Brahma, who represents kindness, compassion, sympathy, and impartiality. Devotees from all over Asia visit to offer marigold garlands and wooden elephants, often hiring traditional Thai dancers to perform when their prayers are answered, creating a vibrant scene of urban devotion.",https://en.wikipedia.org/wiki/Erawan_Shrine
0212,Thai Floating Markets,Floating_market,"Historically, central Thailand was known as the 'Venice of the East' because of its vast network of canals (khlongs). Floating markets were the primary centers of trade, where farmers would bring their produce by boat to sell directly to the community. While many canals have been paved over for roads, markets like Damnoen Saduak and Amphawa preserve this traditional way of life. Today, they offer a nostalgic glimpse into a time when the river was the main highway, and the sounds of wooden paddles and floating vendors defined the rhythm of commerce.",https://en.wikipedia.org/wiki/Floating_market#Thailand
0213,Elephant Conservation,Elephant_nature_park,"The elephant has been the national symbol of Thailand since ancient times, once appearing on the national flag. Historically used in warfare and logging, their role has shifted dramatically in the modern era. Today, Thailand is a leader in ethical elephant conservation, with numerous sanctuaries dedicated to rescuing animals from the tourism and logging industries. These parks allow elephants to live in natural social groups without being forced to perform or carry tourists, emphasizing the importance of respecting the dignity and welfare of these intelligent, gentle giants.",https://en.wikipedia.org/wiki/Elephant_nature_park
0214,Trimurti: The God of Love,Trimurti,"In the heart of Bangkok stands the Trimurti Shrine, famous for its association with romantic luck. The Trimurti represents the three powerful Hindu gods—Brahma, Vishnu, and Shiva—merged into one. While the deity symbolizes the cycle of creation and destruction, many Thais believe the shrine possesses a special power to grant wishes regarding love. On Thursday nights, especially around Valentine's Day, hundreds of young people gather with offerings of nine red roses and red incense, hoping to find their soulmates in the bustling city.",https://en.wikipedia.org/wiki/Trimurti
0215,The Art of the Ramakien,Ramakien,"The Grand Palace murals depict the Ramakien, Thailand's national epic based on the Hindu Ramayana. This sprawling story follows Prince Rama's quest to rescue his wife, Sita, from the demon king Totsakan. The Thai version adds local flavor, including the beloved white monkey general, Hanuman. These stories are more than mythology; they define the traditional Thai moral code and have inspired centuries of classical dance (Khon), literature, and visual art. The vibrant murals at Wat Phra Kaew are a breathtaking visual record of these timeless battles between good and evil.",https://en.wikipedia.org/wiki/Ramakien
0216,Ancient Thai Massage,Thai_massage,"Nuad Thai, or traditional Thai massage, is a 2,500-year-old healing system that combines elements of Indian Yoga, Chinese acupressure, and indigenous Thai herbal medicine. Unlike Western massage, it involves deep stretching and rhythmic pressure applied with hands, elbows, and knees to clear blockages in the body's energy lines (Sen). Traditionally practiced in temples, it was recently added to UNESCO's list of Intangible Cultural Heritage. It is considered a form of 'Metta' (loving-kindness), where the practitioner focuses on bringing physical and spiritual balance to the recipient.",https://en.wikipedia.org/wiki/Thai_massage
0217,The Isan Identity,Isan,"Isan, the vast northeastern region of Thailand, possesses a distinct and vibrant cultural identity. Historically influenced by its proximity to Laos and Cambodia, Isan is known for its unique music (Mor Lam), colorful festivals, and spicy, bold cuisine. Dishes like 'Som Tum' (papaya salad) and 'Larb' (minced meat salad) served with sticky rice have become staples across the entire country. Despite the region's harsh, dry climate, the people of Isan are celebrated for their resilience, warmth, and their deep-rooted pride in their local heritage and traditions.",https://en.wikipedia.org/wiki/Isan
0218,The 13 Smiles of Thailand,Thailand,"Thailand is famously known as the 'Land of Smiles,' but to locals, a smile is a complex tool for social navigation. Thai culture identifies at least 13 distinct types of smiles, each carrying a specific emotional meaning. There is the 'Yim Thak Thai' (polite greeting smile), the 'Yim Cheun Chom' (smile of admiration), and even the 'Yim Soo' (smile in the face of an impossible situation). Smiling is used to maintain social harmony, mask embarrassment, or diffuse tension, reflecting the Thai philosophy of 'Mai Pen Rai'—the art of not letting life's troubles disturb one's inner peace.",https://en.wikipedia.org/wiki/Thailand#Culture
0219,Magha Puja Day,Magha_Puja,"Magha Puja is one of the holiest days in the Buddhist calendar, occurring on the full moon of the third lunar month. It commemorates a miraculous event where 1,250 monks gathered spontaneously to hear the Buddha's teachings without prior appointment. This day is a time for 'Tam Bun' (making merit). In the evening, temples across Thailand are illuminated by 'Wian Tian' processions, where devotees walk three times around the main chapel carrying candles, incense, and flowers, symbolizing the Three Jewels: the Buddha, the Dharma, and the Sangha.",https://en.wikipedia.org/wiki/Magha_Puja
0220,Sukhothai: Dawn of Happiness,Sukhothai_Kingdom,"Founded in 1238, Sukhothai was the first truly independent Thai kingdom, and its name literally means 'The Dawn of Happiness.' This era is considered the 'Golden Age' of Thai history, a period of peace, prosperity, and artistic innovation. It was during this time that King Ramkhamhaeng the Great is said to have created the Thai alphabet. The serene 'Sukhothai style' of Buddha images, characterized by graceful, flowing lines, remains a pinnacle of Thai art. The ruins of the ancient capital now serve as a powerful reminder of the nation's cultural and spiritual foundations.",https://en.wikipedia.org/wiki/Sukhothai_Kingdom
0221,Colors of the Day,Colors_of_the_day_in_Thailand,"An enchanting aspect of Thai culture is the traditional belief in 'lucky colors' for each day of the week, rooted in ancient Hindu astrology. Each day is governed by a specific planet and deity: Monday is Yellow (for the Moon), Tuesday is Pink (for Mars), and so on. Historically, many Thais would choose their clothing based on these colors to ensure good fortune and protection. While less strictly followed today, you will still see yellow shirts worn on Mondays to honor the late King Rama IX, showing how these ancient beliefs continue to influence modern national identity.",https://en.wikipedia.org/wiki/Colors_of_the_day_in_Thailand
0222,Phuket Old Town,Old_Phuket_Town,"Beyond its famous beaches, Phuket Town offers a rich historical experience through its well-preserved 'Sino-Portuguese' architecture. In the 19th century, Phuket became a booming center for tin mining, attracting merchants from China and Europe. This cultural fusion resulted in the beautiful row houses with arched walkways and intricate tiles found in the old quarter today. The local 'Baba-Nyonya' culture, a unique blend of Chinese and Malay influences, still thrives here, evident in the town's famous street food, traditional festivals, and the elegant, colorful attire of its residents.",https://en.wikipedia.org/wiki/Old_Phuket_Town
0223,Khao San Road Legacy,Khaosan_Road,"Khao San Road, a short street in the Banglamphu area, is perhaps the most famous backpacker hub in the world. Originally a quiet rice market (Khao San means 'milled rice'), it transformed in the 1980s as international travelers seeking cheap accommodation near the Grand Palace began to cluster there. Today, it is a sensory-overloading neon-lit jungle of street food, bars, and shops. Despite its commercialization, it remains a vibrant global village where travelers from every corner of the planet meet, exchange stories, and begin their adventures into the heart of Southeast Asia.",https://en.wikipedia.org/wiki/Khaosan_Road
0224,The Elegance of Thai Art,Thai_art,"Traditional Thai art is a deeply spiritual discipline that emphasizes flowing, flame-like lines known as 'Lai Thai.' Whether carved into temple pediments, painted onto lacquerware, or woven into silk, these patterns represent the fluid and interconnected nature of all things. Thai art rarely focuses on realism; instead, it seeks to depict the idealized beauty of the spiritual realm. Mythical creatures like the 'Kinnari' (half-woman, half-bird) and 'Naga' (serpent) are common motifs, serving as guardians of sacred spaces and bridging the gap between the earthly and divine worlds.",https://en.wikipedia.org/wiki/Thai_art
0225,Sacred Rice Culture,Rice_production_in_Thailand,"Rice is the absolute soul of Thailand. The common greeting 'Kin Khao Reu Yang?' (Have you eaten rice yet?) highlights its central role in daily life. Beyond sustenance, rice is considered sacred, protected by the Goddess of Rice, Mae Phosop. Farmers perform ancient rituals to invite her spirit into the fields during planting and harvest. Thailand remains one of the world's top rice exporters, particularly famous for its fragrant Jasmine rice. This deep-rooted agricultural heritage defines the nation's landscape, economy, and its fundamental identity as a land of abundance.",https://en.wikipedia.org/wiki/Rice_production_in_Thailand
0226,Lopburi Monkey Banquet,Lopburi_Monkey_Festival,"The city of Lopburi is famous for its unique co-existence with thousands of long-tailed macaques that roam its ancient Khmer ruins. Each November, the city hosts the Monkey Banquet Festival to thank the animals for bringing tourists to the area. Huge tables are laid out with tons of fruits, vegetables, and traditional desserts for the monkeys to feast upon. This festival reflects the Thai belief in 'making merit' and showing kindness to all living beings, even when they occasionally cause mischief in the town's shops and power lines.",https://en.wikipedia.org/wiki/Lopburi_Monkey_Festival
0227,Nang Talung: Shadow Puppetry,Nang_yai,"Nang Talung is a traditional form of shadow puppetry from Southern Thailand. The puppets are meticulously hand-carved from water buffalo hide and painted with translucent dyes. A single master puppeteer controls the figures behind a backlit screen, providing the voices, music, and improvised jokes. These plays often retell ancient epics or satirical stories about local politics and daily life. It is a highly skilled art form that combines storytelling, music, and craftsmanship, continuing to captivate rural audiences with its blend of ancient folklore and sharp, modern wit.",https://en.wikipedia.org/wiki/Nang_yai
0228,Spirit of Modern Bangkok,Bangkok,"Bangkok, or Krung Thep (City of Angels), is a mesmerizing metropolis of contrasts where the 18th century meets the 22nd. You can find a centuries-old wooden temple tucked away in the shadow of a futuristic glass skyscraper. It is a city of constant motion—from the sleek Skytrain gliding over traffic to the long-tail boats racing down the canals. Bangkok's true magic lies in its ability to adapt and evolve while remaining fiercely proud of its royal and religious traditions, creating a unique urban energy that is both overwhelming and deeply soulful.",https://en.wikipedia.org/wiki/Bangkok#History